{
  "packet_id": "11111111-1111-4111-8111-111111111111",
  "packet_class": "ORCHESTRATION",
  "operation": "INTAKE",
  "objective": "Sliding block",
  "context_summary": "",
  "constraints": [],
  "expected_output": {
    "artifact_type": "PROBLEM_BRIEF",
    "schema_id": "urn:claw:schema:problem-brief:1.0",
    "cardinality": "ONE",
    "allow_partial": false
  },
  "routing_metadata": {
    "selected_executor": "GENERAL_LOCAL",
    "selection_reason_code": "OPERATION_MATCH",
    "selection_reason_detail": "test",
    "policy_version": "v1",
    "budget_policy": { "allow_escalation": false }
  },
  "provenance": {
    "source_stage": "INTAKE",
    "parent_packet_id": null,
    "input_artifact_refs": [],
    "decision_ref": null
  }
}
