{
  "packet_id": "33333333-3333-4333-8333-333333333333",
  "packet_class": "ORCHESTRATION",
  "operation": "SYNTHESIZE",
  "objective": "Summarize verified results",
  "context_summary": "",
  "constraints": [],
  "expected_output": {
    "artifact_type": "PROBLEM_BRIEF",
    "schema_id": "urn:claw:schema:problem-brief:1.0",
    "cardinality": "ONE",
    "allow_partial": false
  },
  "routing_metadata": {
    "selected_executor": "GENERAL_LOCAL",
    "selection_reason_code": "OPERATION_MATCH",
    "selection_reason_detail": "branch",
    "policy_version": "v1",
    "budget_policy": { "allow_escalation": false }
  },
  "provenance": {
    "source_stage": "SYNTHESIZE",
    "parent_packet_id": "11111111-1111-4111-8111-111111111111",
    "input_artifact_refs": ["artifact://engineering_report/latest"],
    "decision_ref": null
  }
}
